{"$schema":"https://json-schema.org/draft/2020-12/schema","title":"LazySeries Canonical Host Event","type":"object","additionalProperties":false,"required":["schema_version","contract_version","record_type","event_id","host","raw_event","canonical_event","occurred_at","surface","payload"],"properties":{"schema_version":{"const":1},"contract_version":{"const":"1.0.0"},"record_type":{"const":"canonical-event"},"event_id":{"$ref":"lazyseries-host-evidence-defs.v1.schema.json#/$defs/id"},"host":{"$ref":"lazyseries-host-evidence-defs.v1.schema.json#/$defs/host"},"raw_event":{"type":"string","minLength":1},"canonical_event":{"enum":["post-tool-use","post-tool-use-failure","pre-compact","pre-tool-use","session-start","stop","stop-failure","subagent-start","subagent-stop","task-completed","task-created","user-prompt-submit","permission-request","permission-denied","notification","post-compact","session-end","instructions-loaded","config-change","cwd-changed","file-changed","worktree-create","worktree-remove","elicitation","elicitation-result","unsupported"]},"occurred_at":{"$ref":"lazyseries-host-evidence-defs.v1.schema.json#/$defs/timestamp"},"surface":{"$ref":"lazyseries-host-evidence-defs.v1.schema.json#/$defs/surface"},"payload":{"type":"object"}}}
