{"schema_version":1,"contract_version":"1.0.0","record_type":"canonical-event","event_id":"evt:unsupported","host":"trae-ide","raw_event":"FutureUnknownEvent","canonical_event":"unsupported","occurred_at":"2026-08-03T09:00:00Z","surface":{"surface_id":"trae-ide:event","native_mode":"unavailable","host_authority":"host","package_owner":"LazyTrae","direction":"none","merge_key":"trae-ide:event","base_digest":"aaaaaaaaaaaaaaaaaaaaaaaaaaaaaaaaaaaaaaaaaaaaaaaaaaaaaaaaaaaaaaaa","freshness":{"status":"current","observed_at":"2026-08-03T09:00:00Z","expires_at":"2026-08-03T11:00:00Z"},"source_receipt":{"receipt_id":"source:unsupported","sha256":"bbbbbbbbbbbbbbbbbbbbbbbbbbbbbbbbbbbbbbbbbbbbbbbbbbbbbbbbbbbbbbbb","redacted":true}},"payload":{"reason":"unknown-event"}}
