{"schema_version":1,"contract_version":"1.0.0","record_type":"canonical-event","event_id":"evt:secret","host":"codebuddy-cli","raw_event":"SessionStart","canonical_event":"session-start","occurred_at":"2026-08-03T09:00:00Z","surface":{"surface_id":"codebuddy-cli:session","native_mode":"invoke-documented","host_authority":"host","package_owner":"LazyBuddy","direction":"host-to-package","merge_key":"codebuddy-cli:session","base_digest":"aaaaaaaaaaaaaaaaaaaaaaaaaaaaaaaaaaaaaaaaaaaaaaaaaaaaaaaaaaaaaaaa","freshness":{"status":"current","observed_at":"2026-08-03T09:00:00Z","expires_at":"2026-08-03T11:00:00Z"},"source_receipt":{"receipt_id":"source:001","sha256":"bbbbbbbbbbbbbbbbbbbbbbbbbbbbbbbbbbbbbbbbbbbbbbbbbbbbbbbbbbbbbbbb","redacted":true}},"payload":{"api_secret":"fixture-marker"}}
